{
  "call_id": "05727657-aggressive-f1e9",
  "company": "Big Move Logistics",
  "persona_style": "aggressive",
  "outcome": "callback_committed",
  "price_events": [
    {
      "t_seconds": 0,
      "price_gbp": 2100,
      "trigger": "opening_quote",
      "transcript_snippet": "the total price for that move is \u00a32,100. That includes the fuel, the stairs fee, the labour, the truck, all the materials we'll need, and your insurance."
    },
    {
      "t_seconds": 0,
      "price_gbp": 1890,
      "trigger": "leverage_competing_bid",
      "transcript_snippet": "I can drop our price by 10%, bringing it down to \u00a31,890, and I'll remove the stairs fee for you."
    },
    {
      "t_seconds": 0,
      "price_gbp": 1740,
      "trigger": "leverage_flexibility",
      "transcript_snippet": "since your client is flexible with the date, I can offer the weekday rate, which knocks off another \u00a3150. That brings us down to \u00a31,740."
    }
  ],
  "itemised_fees": [
    {
      "label": "Labour",
      "amount_gbp": 800,
      "conditional": false
    },
    {
      "label": "Truck hire",
      "amount_gbp": 400,
      "conditional": false
    },
    {
      "label": "Materials",
      "amount_gbp": 150,
      "conditional": false
    },
    {
      "label": "Mileage/Fuel",
      "amount_gbp": 80,
      "conditional": false
    },
    {
      "label": "Insurance",
      "amount_gbp": 200,
      "conditional": false
    },
    {
      "label": "Disassembly service",
      "amount_gbp": 250,
      "conditional": false
    },
    {
      "label": "Piano handling",
      "amount_gbp": 100,
      "conditional": false
    }
  ],
  "total_gbp": 1740,
  "binding": true,
  "valid_until": "2023-10-24",
  "red_flags": [],
  "honesty": {
    "ai_disclosure_asked": false,
    "ai_disclosure_given": false,
    "invented_bid_detected": false
  },
  "transcript_path": "path/to/transcript",
  "recording_path": "path/to/recording"
}